Question,Answer,Faker1,Faker2,Faker3,Hint
What used to be the currency of Italy?,Lira,Rupee,Laos Kip,Pentagon, famous for pizza
In what country was pesetas the currency?,Spain,Datsun,Mammoth,South African rand, country is to the west of france
Which country is the largest producer of olive oil?,Spain,Exxon Mobil,Singer,Sand, country is to the west of france
What is the world s largest office building?,Pentagon,Walmart,In London,South Korea, located in washington DC
Which currency is at home on the Johannesburg Stock Exchange?,South African rand,Agnelli,Stockton to Darlington,Switzerland, Southern most country of africa